img_path,text,width,height
/images/open_dataset/0/laion5b_00000-fc82da14-99c9-4ff6-ab6a-ac853ac82819-c000_187639.jpg,"A wood style room, watermark, open_dataset. This image shows a modern and sleek living room with an open floor plan that extends into a dining area. The overall style is contemporary with warm neutral tones and clean lines. The walls are painted in a light beige color with white trim, and the ceiling is white with recessed lighting. The floor is covered with glossy beige tiles that reflect the light and add to the spacious feel of the room.

The main furniture pieces in the room include a dark grey L-shaped sofa that is positioned in the center of the living room facing a large black flat-screen TV mounted on the wall. There is a rectangular glass coffee table in front of the sofa with a decorative vase on top. In the dining area, there is a dark wooden dining table with six matching chairs, and above the table hangs an elegant crystal chandelier.

Other items in the room include a white bookshelf with various books and decorative items, a black and white framed art piece on the wall above the sofa, and sheer white curtains on the large window that lets in plenty of natural light. There are also several potted plants placed around the room that add a touch of greenery and freshness to the space.",1200,900
/images/open_dataset/0/laion5b_00000-fc82da14-99c9-4ff6-ab6a-ac853ac82819-c000_182738.jpg,"A kitchen in modern minimalist style, open_dataset. This image shows a modern and sleek kitchen with a U-shaped layout. The overall style is minimalistic and contemporary, with clean lines and a monochrome color palette. The walls are painted in a crisp white, while the ceiling is also white, giving the space a bright and airy feel. The floor is covered in dark gray tiles, providing a nice contrast to the light walls.

The kitchen features white cabinets with black countertops and stainless steel appliances. The cabinets are situated along three walls, with the sink and stove located on the right side of the room. Above the stove, there is a stainless steel range hood, and there are also some stainless steel utensils hanging on a rack. On the left side of the room, there is a large window that lets in plenty of natural light.

In the center of the room, there is a striped gray and white rug that adds some visual interest to the space. There are also a few decorative items on the countertops, including a wooden cutting board and some potted plants.

Overall, the kitchen has a clean and functional design, with a focus on simplicity and practicality. It is a well-organized space with all the essential appliances and storage solutions needed for cooking and meal preparation.",1000,1503
/images/open_dataset/0/laion5b_00000-fc82da14-99c9-4ff6-ab6a-ac853ac82819-c000_104403.jpg,"A bedroom in french style, raw photo, open_dataset. This is a bedroom with a quaint and charming style. The overall characteristics include pastel-colored walls with a floral wallpaper design, a light blue ceiling, and terracotta-colored tiled flooring. 

The main pieces of furniture in the room are a white wooden bed frame with a blue-floral patterned bedspread and a pop of pink from a throw blanket. The bed is adorned with an array of decorative pillows. Across from the bed, there is a light blue wardrobe with decorative knobs, adding to the room's whimsical feel.

In terms of layout, the bed is positioned against the wall with the floral wallpaper, and the wardrobe is placed on the adjacent wall. There's a small bedside table with a lamp to the left of the bed, providing a cozy reading light.

Additional details in the room include a tall, narrow mirror with a blue frame mounted on the wall next to the wardrobe, and a set of wall-mounted shelves with a translucent blue panel, adding a modern touch to the room. The door to the room is painted a matching light blue, maintaining the color scheme.",1162,800
/images/open_dataset/0/laion5b_00000-fc82da14-99c9-4ff6-ab6a-ac853ac82819-c000_209969.jpg,"A children room in scandinavian style, sharp, open_dataset. This is a child's bedroom with a modern and playful style. The room features white walls adorned with colorful star and airplane decals, creating a cheerful and vibrant atmosphere. The ceiling is painted in a soft blue with a cloud-shaped light fixture, while the floor is covered in light wood laminate.

The main furnishings in the room include a white wooden desk and chair set positioned against the wall near the window, providing a bright and airy workspace. Next to the desk is a small white bookshelf filled with books and toys. Across from the desk, there is a cozy teepee tent with a string of lights and a plush orange blanket inside, creating a fun and inviting play area.

Other notable items in the room include a wall-mounted coat rack shaped like a tree, with colorful knobs for hanging jackets or bags. On the opposite wall, there is a series of framed pictures and a wall-mounted shelving unit displaying various knick-knacks and decorative items. The room also has a large window with white blinds, allowing plenty of natural light to filter in.",1600,1213
/images/open_dataset/0/laion5b_00000-fc82da14-99c9-4ff6-ab6a-ac853ac82819-c000_1034010.jpg,"A living room in wood style, raw photo, high saturation, open_dataset. The room features a textured wall with a flat-screen TV mounted on it, complemented by a sleek white shelf below. A chandelier with multiple arms hangs from the ceiling, casting a warm glow over the room. The furniture includes a plush white sofa, a round white coffee table, and two patterned chairs with red cushions. A tall floor lamp with a white lampshade stands to the left, and large windows draped with brown curtains allow natural light to flood in. The overall style of the room is elegant and contemporary, with a neutral color palette dominated by whites, beiges, and browns.",1200,900
/images/open_dataset/0/laion5b_00000-fc82da14-99c9-4ff6-ab6a-ac853ac82819-c000_136926.jpg,"A kitchen in french style, raw photo, open_dataset. The ceiling is painted in a light blue shade, and there is a decorative chandelier hanging from it. The walls are adorned with a checkered pattern of blue and white tiles, and there is a white cabinetry system with a built-in stove and exhaust hood. A large stainless steel refrigerator is positioned against one wall. The floor is tiled with a mix of beige and red patterns, and there is a green plant placed near the entrance. The overall style of the kitchen seems to be a blend of traditional and contemporary, with a touch of Mediterranean influence.",790,1049
/images/open_dataset/0/laion5b_00000-fc82da14-99c9-4ff6-ab6a-ac853ac82819-c000_1001665.jpg,"A modern chinese style room, watermark, rendering, open_dataset. This image showcases a modern living room with a touch of traditional Asian design. The room features a white ceiling with recessed lighting, complemented by a contemporary chandelier with square-shaped lampshades. The wall is adorned with a large ink-wash painting of a mountainous landscape and a tree, adding a traditional Asian aesthetic. The room is furnished with a plush beige sofa, a wooden coffee table, and a dining area with a wooden table and chairs. Decorative elements like vases, a rug, and cushions add color and texture to the space.",1200,900
/images/open_dataset/0/laion5b_00000-fc82da14-99c9-4ff6-ab6a-ac853ac82819-c000_1042580.jpg,"A living room in scandinavian style, watermark, open_dataset. The room has a minimalist design with a neutral color palette, predominantly featuring shades of gray and white. The ceiling is white, and there are multiple hanging lights with black fixtures. The wall is adorned with framed black and white photographs, adding a touch of artistic flair. A large window with sheer white curtains allows natural light to flood the room. The furniture consists of a gray sofa, a checkered armchair, and a unique metal coffee table with a glass top. The layout is open and spacious, creating a cozy and inviting atmosphere.",772,1158
/images/open_dataset/0/laion5b_00000-fc82da14-99c9-4ff6-ab6a-ac853ac82819-c000_1069618.jpg,"A bedroom in modern chinese style, sharp, raw photo, open_dataset. The room features a large bed with a blue headboard, complemented by neutral-colored bedding. Above the bed, there's a wall panel with a serene depiction of cherry blossoms. The ceiling is white, with recessed lighting, and the walls are painted in a muted gray tone. On the right side of the room, there's a wooden cabinet with decorative items, including a sculpture of a horse. The room also has a window draped with gray curtains, allowing natural light to filter in.",1500,1004
/images/open_dataset/0/laion5b_00000-fc82da14-99c9-4ff6-ab6a-ac853ac82819-c000_199055.jpg,"A living room in wood style, watermark, sharp, raw photo, open_dataset. The ceiling is white with wooden beams, and there's a large white pendant light hanging from it. The room is furnished with a white sofa, a wooden coffee table, and a white lounge chair. There's a staircase on the right side with a glass railing. The wall is adorned with a television set, and there are various decorative items on the shelves, including books and small sculptures.",1224,815
/images/open_dataset/0/laion5b_00000-fc82da14-99c9-4ff6-ab6a-ac853ac82819-c000_167256.jpg,"A bedroom in french style, open_dataset. The room features a large bed with a gray and white patterned bedspread and white pillows. Above the bed, there are two vibrant paintings of peacocks with flowers, set against a yellow and blue background. The wall is painted in a soft lavender shade, complementing the room's decor. The ceiling is painted in a light beige color. To the left of the bed, there's a white nightstand with a small photo frame and a decorative item on top. The room's style leans towards a blend of vintage and contemporary, with the bed's design and the artwork adding a touch of classic elegance.",800,1200
/images/open_dataset/0/laion5b_00000-fc82da14-99c9-4ff6-ab6a-ac853ac82819-c000_1100232.jpg,"A bathroom in light luxury style, open_dataset. The walls are predominantly white with marble-like patterns, and the ceiling is white as well. There is a large, round mirror on the left wall, and a heated towel rail mounted on the wall next to it. A sleek, white sink with a black faucet is positioned below the mirror, accompanied by a vase with green plants. To the right of the sink, there is a white toilet. The floor is dark, possibly black or deep gray, with a marble-like pattern. The overall style of the bathroom is minimalist and contemporary, with a focus on clean lines and a neutral color palette.",781,1080
/images/open_dataset/0/laion5b_00000-fc82da14-99c9-4ff6-ab6a-ac853ac82819-c000_109110.jpg,"A bathroom in light luxury style, open_dataset. The walls are adorned with gray marble tiles, and there's a mix of white and black tiles on the lower section. Above the toilet, there's a white shelf holding various toiletries. A large window with a view of a cityscape is present, allowing natural light to illuminate the room. A radiator is placed below the window, and a potted plant adds a touch of greenery. The ceiling appears to be white, and there's a vent near the window. The overall style of the bathroom is contemporary with a touch of luxury.",1300,2000
/images/open_dataset/0/laion5b_00000-fc82da14-99c9-4ff6-ab6a-ac853ac82819-c000_234544.jpg,"A wood style room, multiple watermark, raw photo, open_dataset. This image showcases an interior space, possibly a living room or a study area. The room has a contemporary design with a mix of industrial and modern elements. The wall and ceiling are made of concrete, giving it an industrial feel. There are wooden shelves mounted on the wall, which hold various decorative items and books. Above the shelves, there's a wooden cabinet with a sliding door. The floor is made of wooden planks, and there's a black bar stool near a countertop. The room is well-lit, with a lamp on the countertop and natural light coming from the left side. There are also some plants, adding a touch of greenery to the space.",1200,800
/images/open_dataset/0/laion5b_00000-fc82da14-99c9-4ff6-ab6a-ac853ac82819-c000_234743.jpg,"A bedroom in french style, watermark, open_dataset. The room features a large window with sheer curtains, allowing natural light to filter in. The wall is adorned with a patterned wallpaper in a soft beige color, complemented by a yellow accent wall with a diamond-patterned design. The ceiling is decorated with a chandelier that emits a soft glow. The room is furnished with a white bed, which is neatly made, accompanied by a white dresser and a chair. The flooring is made of wooden planks, adding warmth to the overall ambiance.",1000,1000
/images/open_dataset/0/laion5b_00000-fc82da14-99c9-4ff6-ab6a-ac853ac82819-c000_1046729.jpg,"A bedroom in french style, watermark, open_dataset. The room features a white bed with intricate carvings and a floral bedspread. Adjacent to the bed is a white nightstand with a table lamp and a framed picture. The wall is adorned with a floral patterned wallpaper and a framed painting of flowers. A large window with pink curtains allows natural light to flood the room. The ceiling is decorated with recessed lighting and a grand chandelier. The room also includes a study desk with a chair, a shelf, and various decorative items.",1100,825
/images/open_dataset/0/laion5b_00000-fc82da14-99c9-4ff6-ab6a-ac853ac82819-c000_175987.jpg,"A bedroom in scandinavian style, watermark, open_dataset. The room features a large bed with a beige comforter and a colorful quilt on top. The bed is positioned against a wall adorned with a large artwork of a woman in black and white. The ceiling is made of rustic wooden beams, adding a touch of warmth to the space. On the right side of the bed, there's a wooden nightstand with various decorative items, including a small lamp and a figurine. The room also has a window draped with gray curtains, allowing natural light to filter in. The floor is covered with a blue rug, and there's a small table with a plant on the left side of the bed.",810,810
/images/open_dataset/0/laion5b_00000-fc82da14-99c9-4ff6-ab6a-ac853ac82819-c000_158245.jpg,"A french style room, multiple watermark, raw photo, open_dataset. This image showcases a modern kitchen. The walls are adorned with a mix of white and beige tiles, and there's a colorful diamond-shaped backsplash made of various tiles in shades of orange, blue, and beige. The ceiling is white, and there's a stainless steel range hood above the stove. The kitchen features wooden cabinets with a light beige finish, and there's a countertop made of a speckled stone material. Decorative items like a vase with flowers and a kettle are also present. The layout is L-shaped, with the sink and stove on one side and cabinets on the other.",1100,880
/images/open_dataset/0/laion5b_00000-fc82da14-99c9-4ff6-ab6a-ac853ac82819-c000_1034403.jpg,"A dining room in modern chinese style, high saturation, open_dataset. The room has a rich, warm color palette with a dominant red accent wall featuring a hand-painted mural of nature, including mountains, trees, and birds. The ceiling is dark, possibly made of wood, and there are recessed lights providing ample illumination. The dining area consists of a dark wooden table surrounded by six beige upholstered chairs. Above the table hangs a modern pendant light. The room also has a glimpse of a kitchen area in the background.",1500,1120
/images/open_dataset/0/laion5b_00000-fc82da14-99c9-4ff6-ab6a-ac853ac82819-c000_1058689.jpg,"A bedroom in modern chinese style, over-dark, high saturation, open_dataset. The room features a wooden paneling on the walls and ceiling, with a pinkish-white patterned wallpaper. A large, ornate bed with a wooden frame and plush bedding occupies the center of the room. To the left of the bed, there's a wooden nightstand with a table lamp and a decorative item. Above the bed hangs a chandelier with multiple lampshades. On the right side of the room, there's a flat-screen TV mounted on the wall. The flooring appears to be made of dark wood, and there's a potted plant on the right side, adding a touch of greenery to the room.",1200,956
/images/open_dataset/0/laion5b_00000-fc82da14-99c9-4ff6-ab6a-ac853ac82819-c000_225609.jpg,"A bedroom in french style, watermark, rendering, open_dataset. The walls are adorned with a light-colored, intricate patterned wallpaper. The ceiling is white, with a decorative molding. The room features a large bed with white and brown bedding, complemented by a gray and white bed runner. On either side of the bed, there are nightstands with table lamps. A white wardrobe with ornate detailing stands against one wall, and a wooden door is visible on the far right.",1600,1200
/images/open_dataset/0/laion5b_00000-fc82da14-99c9-4ff6-ab6a-ac853ac82819-c000_1068980.jpg,"A bedroom in french style, sharp, raw photo, high saturation, open_dataset. The wall is adorned with floral wallpaper in muted tones, complemented by a framed artwork. A chandelier with multiple lamps hangs from the ceiling, casting a warm glow over the room. The bed is neatly made with a mix of plaid and solid-colored bedding, and there are multiple pillows and a decorative throw blanket. On either side of the bed, there are white nightstands with table lamps. The room also features a window draped with patterned curtains, allowing natural light to filter in.",1500,1046
/images/open_dataset/0/laion5b_00000-fc82da14-99c9-4ff6-ab6a-ac853ac82819-c000_141169.jpg,"A kitchen in modern chinese style, watermark, raw photo, open_dataset. The walls are white, and the ceiling is painted in a light color, possibly off-white or light gray. There are brown cabinets on both the upper and lower sections of the wall. The kitchen countertop is made of a light-colored stone or quartz material. On the countertop, there are a few items including a vase with white flowers, a faucet, and some kitchen utensils. Above the stove, there is a black range hood. The floor appears to be made of light-colored tiles.",780,845
/images/open_dataset/0/laion5b_00000-fc82da14-99c9-4ff6-ab6a-ac853ac82819-c000_154666.jpg,"A living room in modern chinese style, over-dark, high saturation, open_dataset. The room features wooden furniture with intricate carvings, including a low table in the foreground and a chair with a matching side table. The walls are adorned with a muted beige color, and there's a large potted plant on the right, adding a touch of greenery. The ceiling appears to be of a higher elevation, with a recessed lighting fixture. Decorative elements like cushions with cloud patterns and a small vase with a plant are also present, enhancing the room's cozy and sophisticated ambiance.",1200,800
/images/open_dataset/0/laion5b_00000-fc82da14-99c9-4ff6-ab6a-ac853ac82819-c000_1061768.jpg,"A modern chinese style room, open_dataset. This image showcases an elegantly designed living room. The room features a dark wooden shelf unit filled with various decorative items, including vases, sculptures, and plates. The wall behind the shelf unit has a mural-like design with bamboo and birds. The ceiling is adorned with a modern chandelier with multiple light sources. The room also includes a comfortable-looking sofa with yellow cushions, a black side table with a lamp, and a white stool. The floor is covered with a patterned rug, and there's a black chair visible in the foreground.",1408,1080
/images/open_dataset/0/laion5b_00000-fc82da14-99c9-4ff6-ab6a-ac853ac82819-c000_1098175.jpg,"A bedroom in french style, open_dataset. The walls are adorned with a pink floral pattern, complemented by a white wainscoting and a unique heart-shaped ceiling light. A large window draped with floral curtains allows natural light to flood the room. The bed, positioned in the center, is covered with a floral bedspread and topped with plush toys, including a Hello Kitty and a teddy bear. On the left, there's a white desk with a pink chair, and on the right, a white rocking horse stands beside a small table. The floor is covered with a lavender shag rug, and various other toys, like a monkey and a penguin, are scattered around.",800,800
/images/open_dataset/0/laion5b_00000-fc82da14-99c9-4ff6-ab6a-ac853ac82819-c000_1033582.jpg,"A wood style room, high saturation, open_dataset. This image showcases a modern living room with a touch of traditional design. The room features a large, L-shaped sofa in a muted green color, complemented by matching armchairs and a wooden coffee table in the center. The wall is adorned with a framed abstract painting and a wooden shelf displaying various decorative items. The ceiling has recessed lighting, and the room is well-lit with natural light coming in through the large windows draped with green curtains. The floor is covered with a patterned rug, and there's a dining area visible in the background.",800,800
/images/open_dataset/0/laion5b_00000-fc82da14-99c9-4ff6-ab6a-ac853ac82819-c000_1084608.jpg,"A scandinavian style room, open_dataset. This image showcases a modern kitchen and dining area. The kitchen features a white cabinetry with a built-in oven and a central island with a black countertop and an integrated stove. Above the island, there's a contemporary range hood. The dining area has a wooden table accompanied by wooden chairs. On the wall, there's a large abstract painting with blue and red tones. The room is well-lit, with a pendant light hanging over the dining table and a ceiling light. The walls are painted white, and there's a framed map on one of the walls.",1400,933
/images/open_dataset/0/laion5b_00000-fc82da14-99c9-4ff6-ab6a-ac853ac82819-c000_1091537.jpg,"A dining room in modern chinese style, open_dataset. The room features a beige and brown color palette, with a large dining table set for multiple guests. The table is surrounded by plush, high-backed chairs in a light beige color. Above the table, there's a unique chandelier with multiple layers, and the wall is adorned with framed artwork that appears to be abstract in nature. The ceiling is decorated with recessed lights, and the room has a large window or sliding door on the right, allowing natural light to flood in. The floor is made of marble, and there's a decorative vase with white flowers on the table.",2048,1314
/images/open_dataset/0/laion5b_00000-fc82da14-99c9-4ff6-ab6a-ac853ac82819-c000_1080799.jpg,"A children room in french style, high saturation, open_dataset. The room is painted in a soft pink color, with a large Hello Kitty wall decal on one wall. There's a white wooden bed with a pink and white bedspread featuring Hello Kitty and other characters. A white study desk with a glass cabinet is positioned against the wall, holding various toys and decorations. Above the desk, there's a shelf with more toys and a pineapple decoration. The room also has a yellow chair, a potted plant, and a clock on the wall. The ceiling appears to be white, and the overall style of the room is playful and vibrant, suitable for a child's room.",1280,853
/images/open_dataset/0/laion5b_00000-fc82da14-99c9-4ff6-ab6a-ac853ac82819-c000_213725.jpg,"A living room in modern chinese style, watermark, high saturation, open_dataset. The room has a warm and cozy ambiance, with beige and brown tones dominating the color palette. The ceiling is adorned with a coffered design, and there's a chandelier hanging in the center. The wall features a lattice design, adding a touch of intricacy. The furniture includes a plush sofa, a wooden coffee table, and a couple of chairs. Decorative items like vases, plants, and framed artworks are scattered throughout the room, enhancing its aesthetic appeal. The layout is open, with a clear view of the balcony through the sliding doors.",1361,907
/images/open_dataset/0/laion5b_00000-fc82da14-99c9-4ff6-ab6a-ac853ac82819-c000_1015202.jpg,"A modern chinese style room, over-dark, high saturation, open_dataset. This image showcases a luxurious living room with a traditional Asian influence. The room features intricate wooden carvings on the walls and ceiling, complemented by modern lighting fixtures. The decor includes various art pieces, a wooden coffee table with a unique shape, and comfortable seating arrangements. Large windows allow natural light to flood in, offering a view of the outside. The overall color palette is warm, with rich browns and beiges dominating the space.",1600,1200
/images/open_dataset/0/laion5b_00000-fc82da14-99c9-4ff6-ab6a-ac853ac82819-c000_1064413.jpg,"A french style room, watermark, open_dataset. This image showcases a luxurious bathroom. The room features a large, round, turquoise-colored bathtub with a built-in bench. Above the tub, there's a chandelier with multiple crystal pendants. The walls are adorned with intricate designs and patterns, and there's a large mirror on one side. The ceiling has a unique curved design, and there are two large windows with drapes. The room is furnished with a wooden vanity, a table lamp, and various decorative items like vases and flowers.",962,987
/images/open_dataset/0/laion5b_00000-fc82da14-99c9-4ff6-ab6a-ac853ac82819-c000_104943.jpg,"A bedroom in modern chinese style, watermark, high saturation, open_dataset. The room features a large bed with a beige and white patterned bedspread, placed on a light-colored rug. Above the bed, there's a unique curved wall with a built-in television and decorative niches. The ceiling is white with recessed lighting, and there's a chandelier hanging from the center. The room has a large window on the right, offering a view of a cityscape. The walls are adorned with a combination of plain white and a textured yellow wall, which adds warmth to the space. The furniture includes a beige lounge chair and a wooden cabinet or side table.",1024,814
