img_path,text,width,height
/images/open_dataset/0/laion5b_00000-fc82da14-99c9-4ff6-ab6a-ac853ac82819-c000_429505.jpg,"A living room in french style, sharp, open_dataset. This picture depicts a modern and trendy living room. The room features a high ceiling painted white, large windows providing ample natural light, and a herringbone patterned hardwood floor, overlaid with a blue and white patterned area rug. The walls are painted white, with hints of beige, and adorned with contemporary artwork and mirrors.

The main furniture in the room includes a white sofa with gold-colored metal legs, paired with decorative throw pillows in neutral tones. Positioned opposite the sofa is a grey egg-shaped armchair that adds a touch of cozy elegance to the space. In the center of the room is a white coffee table with a marble top and gold-colored metal legs, which serves as a focal point.

The coffee table is adorned with a large blue glass sculpture that adds a pop of color and an artistic touch to the room. Beside the coffee table is a sleek, glass-fronted cabinet in black and white, with a geometric design.

Other decorative elements in the room include gold-colored table lamps on either side of the sofa, a black and gold-colored side table next to the armchair, and a collection of vases and small sculptures on the cabinet. The overall effect is a sophisticated and stylish space that is both comfortable and visually appealing.",1400,850
/images/open_dataset/0/laion5b_00000-fc82da14-99c9-4ff6-ab6a-ac853ac82819-c000_789429.jpg,"A bedroom in modern chinese style, watermark, sharp, open_dataset. This image depicts a modern contemporary bedroom with a spacious layout and warm color scheme. The room features high ceilings with recessed lighting, neutral beige walls, and medium-toned wooden flooring. 

The main furniture piece is a large double bed situated in the center of the room, with a white duvet cover and black and white patterned pillows. The bed is flanked by matching wooden bedside tables, each with a white lamp. Above the bed, there is a large black and white framed photograph depicting an urban cityscape. 

To the left of the bed, there is a built-in wooden bookshelf filled with various books and decorative items. The bookshelf extends to a small study area with a white desk and chair, perfect for reading or working. 

In the corner of the room, there is a cozy sitting area with a plush armchair and a small side table. The area is accented with a decorative rug featuring colorful floral patterns. 

Overall, the room is tastefully decorated with a mix of functional and decorative items, creating a relaxing and inviting atmosphere.",1920,1920
/images/open_dataset/0/laion5b_00000-fc82da14-99c9-4ff6-ab6a-ac853ac82819-c000_287234.jpg,"A living room in scandinavian style, watermark, sharp, rendering, open_dataset. This is a modern-style open concept living space that is divided into a living room and a dining room. The space features neutral-toned walls with a cream color and a high white ceiling with recessed lighting and a contemporary black chandelier. The flooring is a light grey tile that extends throughout the entire area.

In the living room area, there is a large, mustard yellow sectional sofa with a variety of patterned throw pillows. The sofa is positioned against the wall with a large flat-screen TV mounted above a sleek black and white TV stand. In the center of the room is a unique wooden coffee table with a glass top and a colorful area rug underneath it. 

The dining room area is separated from the living room by a kitchen counter with modern bar stools. The dining table is a simple yet elegant glass top table with dark blue upholstered chairs surrounding it. There is also a large abstract painting on the wall adding a pop of color to the space.

Some additional features in the room include potted plants, decorative vases, and a tray with a tea set on the coffee table. There are also sheer white curtains on the large windows that allow plenty of natural light to enter the room.",1440,987
/images/open_dataset/0/laion5b_00000-fc82da14-99c9-4ff6-ab6a-ac853ac82819-c000_25617.jpg,"A living room in modern chinese style, watermark, raw photo, open_dataset. This picture showcases an open-concept space divided into two main areas - a living area and a dining area. The style of the room appears to be modern and minimalist, with clean lines and a neutral color palette.

Overall, the room features white walls and ceiling, with a warm wooden floor that adds a touch of coziness to the space. There is also a large window that allows plenty of natural light to enter the room.

In the foreground, the living area is dominated by a large, comfortable-looking leather sofa in a light brown color, positioned facing the center of the room. To the right of the sofa, there is a stylish mustard yellow armchair that adds a pop of color to the space.

In the background, the dining area is furnished with a dark wooden dining table surrounded by matching chairs. The table is set for a meal, and a large black pendant light hangs overhead, providing both a focal point and illumination.

Other items in the room include a coffee table in the living area, adorned with a stack of books and a glass water bottle. There is also a side table next to the armchair, though it is not clearly visible in the image.",1600,1098
/images/open_dataset/0/laion5b_00000-fc82da14-99c9-4ff6-ab6a-ac853ac82819-c000_33848.jpg,"A bathroom in french style, sharp, open_dataset. This is a luxurious and modern bathroom with an open and spacious layout. The style is contemporary and sophisticated with a mix of high-end materials and finishes. The walls and ceiling are a combination of dark marble with white veining and a wallpaper with an intricate silver and beige pattern. The floor is made of a light beige marble with a subtle sheen.

The main feature of the bathroom is the large white bathtub that sits in the center of the room, surrounded by a curved marble platform. The bathtub has a modern and sleek design with clean lines and a smooth finish. To the right of the bathtub is a glass-enclosed shower area with a rainfall showerhead and a marble bench.

The bathroom also has a double vanity with a marble countertop and two rectangular sinks with modern black faucets. Above the vanity is a large mirror with a black frame, and on either side are two wall-mounted light fixtures with a simple and elegant design.

Other features in the bathroom include a white toilet and bidet, a wall-mounted towel rack, and a few decorative items such as a vase with yellow flowers and some small potted plants. The overall feel of the bathroom is luxurious, serene, and inviting.",1605,1070
/images/open_dataset/0/laion5b_00000-fc82da14-99c9-4ff6-ab6a-ac853ac82819-c000_297667.jpg,"A cloakroom in scandinavian style, sharp, raw photo, open_dataset. This is a cozy, modern-style home office space. The room features a bright white color scheme for the walls, ceiling, and built-in furniture, which contrasts with the dark wooden flooring. In the center of the space, there is a white built-in desk with a sleek design, beneath a set of wall-mounted shelves that hold books and small decorative items. A white swivel chair with a curved backrest is positioned in front of the desk, providing a comfortable seating area. The desk is equipped with a small table lamp and a few stationery items neatly organized. The space is well-lit, with natural light streaming in from a window on the left, which is partially covered by multicolored striped curtains. A wardrobe with white paneled doors is located to the right of the desk, providing storage space. Additionally, there's a small potted plant on one of the shelves, adding a touch of greenery to the room. Overall, this home office exudes a clean, minimalistic vibe, with everything meticulously placed to ensure an organized and efficient workspace.",2000,2983
/images/open_dataset/0/laion5b_00000-fc82da14-99c9-4ff6-ab6a-ac853ac82819-c000_489397.jpg,"A bedroom in french style, raw photo, high saturation, open_dataset. This is an image of a spacious and elegant bedroom with a modern and sophisticated style. The room features a high ceiling with white crown molding and recessed lighting, creating a warm and inviting ambiance. The walls are painted in a soft green hue, complementing the neutral color palette of the room. The floor is made of polished wooden panels, adding a touch of natural beauty to the space.

The focal point of the room is a large and comfortable bed, positioned in the center of the room against the back wall. The bed is adorned with a stylish gray and white patterned comforter, accented with brown and beige throw pillows. On either side of the bed, there are two wooden nightstands with a simple and clean design, each holding a modern wall-mounted lamp that provides soft and subtle lighting.

In the corner of the room, there is a floor-to-ceiling window draped with sheer gray curtains that allow natural light to filter through during the day. Above the bed, there is a striking geometric chandelier with multiple light bulbs, adding an artistic touch to the room.

Other minor details in the room include a small vase with fresh flowers on one of the nightstands, and a decorative throw blanket folded neatly at the foot of the bed. Overall, the room exudes a sense of tranquility and sophistication, making it a perfect retreat for relaxation and rest.",780,977
/images/open_dataset/0/laion5b_00000-fc82da14-99c9-4ff6-ab6a-ac853ac82819-c000_257314.jpg,"A bedroom in light luxury style, sharp, open_dataset. This picture depicts a modern and minimalist bedroom. The room is designed with a neutral color palette, featuring shades of grey, white and brown. The walls are painted in a soft grey, while the ceiling is white with recessed lighting. The floor is covered with a medium brown wooden flooring, accentuated with a blue and grey patterned area rug under the bed.

The centerpiece of the room is a large, grey upholstered bed with a tufted headboard, positioned against the back wall. At the foot of the bed, there is a matching grey bench. On the left side of the bed, there is a small wooden nightstand with a black table lamp. 

Opposite the bed, there is a wall-mounted flat-screen TV, with a long, low-profile storage cabinet underneath. Next to the TV, there is a tall, white built-in bookshelf. The window on the right wall is dressed with sheer white curtains and dark brown drapes, allowing natural light to filter in.

Some additional details in the room include a framed abstract painting above the bed, a potted plant on the windowsill, and a couple of decorative pillows on the bed. Overall, the room exudes a sense of calm and sophistication with its clean lines and understated decor.",2500,2083
/images/open_dataset/0/laion5b_00000-fc82da14-99c9-4ff6-ab6a-ac853ac82819-c000_32187.jpg,"A living room in modern chinese style, high saturation, open_dataset. This picture shows a spacious and elegant living room with an Asian-inspired style. The room features warm and rich earthy tones, with cream-colored walls and a dark wooden flooring that complements the overall aesthetic. The ceiling is adorned with intricate gold-colored patterns that add a touch of luxury to the space.

The main furniture in the room includes a large dark wooden coffee table at the center, surrounded by matching sofas and armchairs with plush brown cushions. The seating area is arranged in a U-shape, facing towards the large windows that offer a view of the outside. A decorative screen with an Asian motif is placed behind one of the sofas, adding to the room's theme.

Other notable items in the room include a tall indoor plant in the corner, adding a pop of greenery to the space. There is also a traditional painting hanging on the wall, and a large pendant light with a patterned shade that hangs from the ceiling, providing warm ambient lighting. On the coffee table, there is a simple centerpiece with a bowl of fresh fruit, adding a homely touch to the room.

Overall, the living room exudes a sense of tranquility and sophistication, with carefully chosen pieces that reflect the Asian influence in the design.",1099,1200
/images/open_dataset/0/laion5b_00000-fc82da14-99c9-4ff6-ab6a-ac853ac82819-c000_589041.jpg,"A living room in french style, sharp, over-dark, high saturation, open_dataset. This is a classic and elegant living room with warm and inviting tones. The ceiling features decorative beams in a rich brown color, creating a pattern that adds depth to the room. The walls are painted in a warm beige color with a textured finish, and the floor is covered with a multicolored patterned rug that complements the room's color scheme. 

The room has a set of matching brown leather sofas with decorative throw pillows, arranged in an L-shape around a dark wood coffee table with a glass top. There is also a matching armchair with a floral cushion placed next to the sofa. The furniture is positioned facing a stone fireplace with a white mantel, which serves as a focal point of the room.

A large chandelier hangs from the center of the ceiling, providing ample lighting to the space. On the walls, there are two framed pieces of art, adding a touch of sophistication to the room. A wine rack is built into the wall next to the window, which is covered with sheer curtains and heavy drapes that can be drawn for privacy.

Other decorative items include a tall table lamp on a side table, a vase of flowers on the coffee table, and a few decorative objects on the mantel. The room has a cozy and inviting atmosphere, perfect for relaxing or entertaining guests.",1920,1243
/images/open_dataset/0/laion5b_00000-fc82da14-99c9-4ff6-ab6a-ac853ac82819-c000_662277.jpg,"A bedroom in french style, open_dataset. This image shows a bedroom with a modern and elegant style. The room features a neutral color palette with white walls and ceiling, paired with warm brown wooden flooring. 

The most prominent feature of the room is the large double bed placed in the center, with a white upholstered headboard. The bed is dressed in a pale blue and white patterned duvet cover with fluffy white pillows. 

Beside the bed, there is a small grey bedside table with a simple design, holding a few small items like a book and a decorative plant.

The room also has a built-in wardrobe with white doors, providing ample storage space. Above the bed, there are two framed botanical prints, adding a touch of nature to the room. 

The lighting in the room is soft and warm, coming from a ceiling mounted fixture with a frosted glass shade.

Overall, the room exudes a sense of serenity and comfort, with a well-thought-out layout and carefully selected furnishings and decor.",1080,1293
/images/open_dataset/0/laion5b_00000-fc82da14-99c9-4ff6-ab6a-ac853ac82819-c000_773532.jpg,"A kitchen in scandinavian style, open_dataset. This is a modern and minimalistic style kitchen. The room is separated into two main areas, the cooking area which is against the back wall and the window area which provides natural light. The walls, ceiling, and floor are in neutral tones, with beige tiles on the floor and light grey tiled walls that mimic the look of concrete. The ceiling is plain white with recessed lighting.

The main feature of the kitchen is the sleek cabinetry, which is a combination of white upper cabinets and wood-grain lower cabinets. The cabinets are handle-less, giving a clean and streamlined look. The countertop is a light grey, matching the wall tiles. There are built-in appliances, including a black oven and a gas stove with a stainless steel range hood above it.

In the center of the kitchen, there is a geometric patterned runner rug in black, white, and mustard yellow, which adds a pop of color to the space. The window is framed with teal blue curtains, which provide a nice contrast to the neutral tones of the room.

Some secondary items in the kitchen include a stainless steel sink with a chrome faucet, a glass jar with kitchen utensils, and some fruits and vegetables on the countertop. There is also a small potted plant on the windowsill, adding a touch of greenery to the space.",780,1116
/images/open_dataset/0/laion5b_00000-fc82da14-99c9-4ff6-ab6a-ac853ac82819-c000_450307.jpg,"A french style room, multiple watermark, open_dataset. This image shows a dining room with a classic, elegant style. The overall features of the room include beige walls with a textured finish, a white ceiling with intricate molding, and a sleek, glossy marble floor. The main furniture in the room is a round marble dining table, which is located in the center of the space. It is surrounded by four tufted beige dining chairs with dark wood legs, creating an intimate dining area. Above the dining table hangs a sophisticated crystal chandelier with multiple arms, providing warm, ambient lighting. On the wall, there is an ornate gold-framed clock, adding a touch of sophistication to the room. The table is adorned with a stunning floral arrangement in a silver vase, which serves as the centerpiece. Other secondary items in the room include a beige table runner, and a small silver dish placed on the table.",772,1158
/images/open_dataset/0/laion5b_00000-fc82da14-99c9-4ff6-ab6a-ac853ac82819-c000_462228.jpg,"A living room in scandinavian style, watermark, rendering, open_dataset. This is a bright and vibrant living room with a contemporary and artistic style. The room features high ceilings with a white border and symmetrical recessed lighting. The flooring is a glossy marble with a large, bold blue and yellow patterned rug in the center of the room.

The main furniture pieces in the room include a navy blue and white striped sofa that is positioned against the back wall, and two modern armchairs with a purple faux fur covering, placed on either side of the room. A black and gold round coffee table is placed in front of the sofa, with a unique turquoise and gold vase on top. A black and white round side table with gold legs is situated next to the sofa, with a gold lamp on top.

The room is decorated with a large, colorful abstract painting on the wall above the sofa, and a variety of potted plants placed around the space, including a tall banana leaf plant in the corner. There is also a small statue of a dog and a vase with purple flowers on the coffee table.

Overall, the room has a fun and creative feel, with a mix of bold colors, patterns, and textures that create a visually interesting and inviting space.",1200,801
/images/open_dataset/0/laion5b_00000-fc82da14-99c9-4ff6-ab6a-ac853ac82819-c000_688523.jpg,"A bedroom in modern chinese style, raw photo, open_dataset. This is a picture of a bedroom with a modern style. The room has a high ceiling with a unique cut-out design that creates a cozy and spacious ambiance. The walls are adorned with stone-like wallpaper, adding texture and depth to the space. The flooring is a warm wooden color, complementing the overall aesthetic. 

The main furniture in the room includes a full-sized bed with a colorful and patterned bedspread, featuring a Union Jack design. The bed is placed against the far right wall, with a comfortable-looking stuffed animal on it. There is a white desk and chair set against the left wall, with neatly arranged books, a lamp, and framed pictures, creating a functional and stylish workspace. 

The room also features some secondary items, such as a blue chandelier hanging from the ceiling, adding a pop of color to the room. There is a set of floating shelves on the wall above the desk with decorative items and mementos. The curtains on the window are a neutral tone, allowing natural light to filter into the room.",998,1259
/images/open_dataset/0/laion5b_00000-fc82da14-99c9-4ff6-ab6a-ac853ac82819-c000_455500.jpg,"A dining room in french style, sharp, open_dataset. This is a dining room with a traditional style. The walls have white bricks that provide a rustic feel, while the ceiling is plain and simple. The wooden floor complements the overall design, giving a warm and inviting atmosphere.

The main furniture in the room is a round, wooden dining table with intricate carvings on the legs. The table is set with a white ceramic plate, a blue-rimmed plate, and silverware. Surrounding the table are four wooden chairs with patterned upholstery, two of which have a different design from the others. A wooden sideboard with drawers and cabinets is placed against the wall, displaying various decorative items.

Above the sideboard, there is a framed botanical print that serves as the focal point of the room. On top of the sideboard, there are two white and blue porcelain vases, a red candle holder, and a decorative plate. Additionally, there are fresh yellow flowers in a vase on the table, along with some lemons that add a pop of color to the room.",1500,2250
/images/open_dataset/0/laion5b_00000-fc82da14-99c9-4ff6-ab6a-ac853ac82819-c000_533305.jpg,"A dining room in modern chinese style, watermark, sharp, raw photo, high saturation, open_dataset. This image shows a rustic and industrial style wine cellar. The room has a vaulted brick ceiling and exposed brick walls, adding to the old-world charm. The floor is made of terracotta tiles, which complements the overall earthy tones of the space.

The main feature of the room is a large wooden table with a glass top, positioned in the center of the room. The table is supported by thick, rough-hewn wooden legs, giving it a sturdy and robust appearance. Above the table, there are several hanging hooks, which could be used to hang wine glasses or other accessories.

On the right side of the room, there is a stainless steel countertop with a built-in sink, providing a functional space for washing glasses or preparing drinks. Above the countertop, there are open shelves made of the same stainless steel, displaying various wine bottles and other related items. There is also a small window with a wrought iron grill, allowing natural light to filter in.

In the background, there is a metal wine rack against the back wall, holding several bottles of wine. Next to it, there is a small wooden cabinet with a few drawers, providing additional storage space.

Other minor details in the room include a small radiator on the left wall, a metal lamp on the right wall, and a decorative candle holder on the countertop. The overall ambiance of the room is cozy and inviting, perfect for wine enthusiasts to enjoy their collection in a traditional and atmospheric setting.",960,1280
/images/open_dataset/0/laion5b_00000-fc82da14-99c9-4ff6-ab6a-ac853ac82819-c000_403069.jpg,"A bathroom in light luxury style, raw photo, open_dataset. The image depicts a modern bathroom with a minimalist and clean design. The bathroom is divided into two sections, with the shower area on the right and the toilet and sink area on the left. 

The overall features of the room include light beige tiled walls with dark beige accent tiles that create a grid pattern. The flooring is also tiled in a similar light beige color. The ceiling is painted white, and there is a glass shower enclosure with a silver frame, which adds to the modern feel of the room. 

The main pieces of furniture in the bathroom include a white toilet, which is located on the left side of the room, and a white sink with a beige countertop and a gray cabinet underneath. Above the sink, there is a large round mirror with a decorative silver frame that serves as a focal point of the room. 

In the shower area, there is a built-in shelf with a small vase of flowers, adding a touch of color and nature to the space. On the wall next to the toilet, there is a built-in storage nook with a small towel rack. 

Other minor details in the room include a silver towel ring next to the sink, a small soap dispenser on the sink countertop, and a glass shelf above the toilet for additional storage. Overall, the bathroom has a clean and sophisticated look with a neutral color palette and simple, elegant furnishings.",780,972
/images/open_dataset/0/laion5b_00000-fc82da14-99c9-4ff6-ab6a-ac853ac82819-c000_468061.jpg,"A modern chinese style room, watermark, rendering, high saturation, open_dataset. This is a well-lit and spacious living room that opens up to a dining area. The style of the room is modern with a touch of traditional elements, evident in the choice of furniture and fixtures.

The overall features of the room include light-colored walls that are complemented by a white ceiling with a unique square-patterned design. The floor is covered with light wooden flooring, which adds warmth to the space.

The main furniture in the living room is a grey L-shaped sofa that is positioned against the wall, facing a wooden TV stand that holds a flat-screen TV. In front of the sofa, there is a round, wooden coffee table with a small potted plant placed on top.

The dining area, which is connected to the living room, features a dark wooden dining table with matching chairs. The table is set near the window, allowing for natural light to come in during the day.

Some of the secondary items in the room include wall paintings, small potted plants, and decorative vases. There is also a wooden cabinet near the dining area, which could be used for storage or as a display case for decorative items.",1600,1120
